[
  {
    "alert_id": "ALT-IN-AP-VSK-MVP-053-20261002-DEN",
    "timestamp": "2026-10-02T00:00:00Z",
    "country_code": "IN",
    "phc_id": "IN-AP-VSK-MVP-053",
    "district": "Visakhapatnam",
    "pattern_type": "DENGUE_LIKE",
    "confidence_score": 0.8,
    "severity": "EMERGENCY",
    "correlated_resources": [
      "Paracetamol 500 mg tablet",
      "ORS sachet 20.5g",
      "IV Normal Saline 0.9% 500 mL",
      "Ringer's Lactate 500 mL",
      "Artemether-Lumefantrine tablet",
      "Amoxicillin 500 mg capsule",
      "Azithromycin 500 mg tablet",
      "Metformin 500 mg tablet",
      "Amlodipine 5 mg tablet",
      "Iron-Folic Acid tablet",
      "Zinc sulfate dispersible tablet 20 mg",
      "Disposable syringe 5 mL with needle",
      "Gloves examination sterile/non-sterile",
      "Dengue NS1/IgG/IgM rapid test kit",
      "CBC diagnostic reagent kit",
      "Ciprofloxacin 500 mg tablet",
      "Paracetamol Paediatric Syrup 125 mg/5 mL",
      "Oxytocin Injection 5 IU/mL"
    ],
    "primary_driver": "Paracetamol 500 mg tablet",
    "spatial_cluster_size": 1,
    "recommended_actions": [
      "Pre-position stock of DENGUE_LIKE essential items",
      "Alert district health officer for epidemiological verification",
      "Increase safety stock buffer at facility"
    ]
  },
  {
    "alert_id": "ALT-IN-AS-GHY-GNS-025-20261002-DEN",
    "timestamp": "2026-10-02T00:00:00Z",
    "country_code": "IN",
    "phc_id": "IN-AS-GHY-GNS-025",
    "district": "Kamrup Metropolitan",
    "pattern_type": "DENGUE_LIKE",
    "confidence_score": 0.8,
    "severity": "EMERGENCY",
    "correlated_resources": [
      "Paracetamol 500 mg tablet",
      "ORS sachet 20.5g",
      "IV Normal Saline 0.9% 500 mL",
      "Ringer's Lactate 500 mL",
      "Artemether-Lumefantrine tablet",
      "Amoxicillin 500 mg capsule",
      "Azithromycin 500 mg tablet",
      "Metformin 500 mg tablet",
      "Amlodipine 5 mg tablet",
      "Iron-Folic Acid tablet",
      "Zinc sulfate dispersible tablet 20 mg",
      "Disposable syringe 5 mL with needle",
      "Gloves examination sterile/non-sterile",
      "Dengue NS1/IgG/IgM rapid test kit",
      "CBC diagnostic reagent kit",
      "Ciprofloxacin 500 mg tablet",
      "Paracetamol Paediatric Syrup 125 mg/5 mL",
      "Oxytocin Injection 5 IU/mL"
    ],
    "primary_driver": "Paracetamol 500 mg tablet",
    "spatial_cluster_size": 1,
    "recommended_actions": [
      "Pre-position stock of DENGUE_LIKE essential items",
      "Alert district health officer for epidemiological verification",
      "Increase safety stock buffer at facility"
    ]
  },
  {
    "alert_id": "ALT-IN-AS-GHY-JAL-026-20261002-DEN",
    "timestamp": "2026-10-02T00:00:00Z",
    "country_code": "IN",
    "phc_id": "IN-AS-GHY-JAL-026",
    "district": "Kamrup Metropolitan",
    "pattern_type": "DENGUE_LIKE",
    "confidence_score": 0.8,
    "severity": "EMERGENCY",
    "correlated_resources": [
      "Paracetamol 500 mg tablet",
      "ORS sachet 20.5g",
      "IV Normal Saline 0.9% 500 mL",
      "Ringer's Lactate 500 mL",
      "Artemether-Lumefantrine tablet",
      "Amoxicillin 500 mg capsule",
      "Azithromycin 500 mg tablet",
      "Metformin 500 mg tablet",
      "Amlodipine 5 mg tablet",
      "Iron-Folic Acid tablet",
      "Zinc sulfate dispersible tablet 20 mg",
      "Disposable syringe 5 mL with needle",
      "Gloves examination sterile/non-sterile",
      "Dengue NS1/IgG/IgM rapid test kit",
      "CBC diagnostic reagent kit",
      "Ciprofloxacin 500 mg tablet",
      "Paracetamol Paediatric Syrup 125 mg/5 mL",
      "Oxytocin Injection 5 IU/mL"
    ],
    "primary_driver": "Paracetamol 500 mg tablet",
    "spatial_cluster_size": 1,
    "recommended_actions": [
      "Pre-position stock of DENGUE_LIKE essential items",
      "Alert district health officer for epidemiological verification",
      "Increase safety stock buffer at facility"
    ]
  },
  {
    "alert_id": "ALT-IN-BR-PAT-DAN-020-20261002-DEN",
    "timestamp": "2026-10-02T00:00:00Z",
    "country_code": "IN",
    "phc_id": "IN-BR-PAT-DAN-020",
    "district": "Patna",
    "pattern_type": "DENGUE_LIKE",
    "confidence_score": 0.8,
    "severity": "EMERGENCY",
    "correlated_resources": [
      "Paracetamol 500 mg tablet",
      "ORS sachet 20.5g",
      "IV Normal Saline 0.9% 500 mL",
      "Ringer's Lactate 500 mL",
      "Artemether-Lumefantrine tablet",
      "Amoxicillin 500 mg capsule",
      "Azithromycin 500 mg tablet",
      "Metformin 500 mg tablet",
      "Amlodipine 5 mg tablet",
      "Iron-Folic Acid tablet",
      "Zinc sulfate dispersible tablet 20 mg",
      "Disposable syringe 5 mL with needle",
      "Gloves examination sterile/non-sterile",
      "Dengue NS1/IgG/IgM rapid test kit",
      "CBC diagnostic reagent kit",
      "Ciprofloxacin 500 mg tablet",
      "Paracetamol Paediatric Syrup 125 mg/5 mL",
      "Oxytocin Injection 5 IU/mL"
    ],
    "primary_driver": "Paracetamol 500 mg tablet",
    "spatial_cluster_size": 1,
    "recommended_actions": [
      "Pre-position stock of DENGUE_LIKE essential items",
      "Alert district health officer for epidemiological verification",
      "Increase safety stock buffer at facility"
    ]
  },
  {
    "alert_id": "ALT-IN-BR-PAT-KKB-019-20261002-DEN",
    "timestamp": "2026-10-02T00:00:00Z",
    "country_code": "IN",
    "phc_id": "IN-BR-PAT-KKB-019",
    "district": "Patna",
    "pattern_type": "DENGUE_LIKE",
    "confidence_score": 0.8,
    "severity": "EMERGENCY",
    "correlated_resources": [
      "Paracetamol 500 mg tablet",
      "ORS sachet 20.5g",
      "IV Normal Saline 0.9% 500 mL",
      "Ringer's Lactate 500 mL",
      "Artemether-Lumefantrine tablet",
      "Amoxicillin 500 mg capsule",
      "Azithromycin 500 mg tablet",
      "Metformin 500 mg tablet",
      "Amlodipine 5 mg tablet",
      "Iron-Folic Acid tablet",
      "Zinc sulfate dispersible tablet 20 mg",
      "Disposable syringe 5 mL with needle",
      "Gloves examination sterile/non-sterile",
      "Dengue NS1/IgG/IgM rapid test kit",
      "CBC diagnostic reagent kit",
      "Ciprofloxacin 500 mg tablet",
      "Paracetamol Paediatric Syrup 125 mg/5 mL",
      "Oxytocin Injection 5 IU/mL"
    ],
    "primary_driver": "Paracetamol 500 mg tablet",
    "spatial_cluster_size": 1,
    "recommended_actions": [
      "Pre-position stock of DENGUE_LIKE essential items",
      "Alert district health officer for epidemiological verification",
      "Increase safety stock buffer at facility"
    ]
  },
  {
    "alert_id": "ALT-IN-CG-RPR-SHK-042-20261002-DEN",
    "timestamp": "2026-10-02T00:00:00Z",
    "country_code": "IN",
    "phc_id": "IN-CG-RPR-SHK-042",
    "district": "Raipur",
    "pattern_type": "DENGUE_LIKE",
    "confidence_score": 0.8,
    "severity": "EMERGENCY",
    "correlated_resources": [
      "Paracetamol 500 mg tablet",
      "ORS sachet 20.5g",
      "IV Normal Saline 0.9% 500 mL",
      "Ringer's Lactate 500 mL",
      "Artemether-Lumefantrine tablet",
      "Amoxicillin 500 mg capsule",
      "Azithromycin 500 mg tablet",
      "Metformin 500 mg tablet",
      "Amlodipine 5 mg tablet",
      "Iron-Folic Acid tablet",
      "Zinc sulfate dispersible tablet 20 mg",
      "Disposable syringe 5 mL with needle",
      "Gloves examination sterile/non-sterile",
      "Dengue NS1/IgG/IgM rapid test kit",
      "CBC diagnostic reagent kit",
      "Ciprofloxacin 500 mg tablet",
      "Paracetamol Paediatric Syrup 125 mg/5 mL",
      "Oxytocin Injection 5 IU/mL"
    ],
    "primary_driver": "Paracetamol 500 mg tablet",
    "spatial_cluster_size": 1,
    "recommended_actions": [
      "Pre-position stock of DENGUE_LIKE essential items",
      "Alert district health officer for epidemiological verification",
      "Increase safety stock buffer at facility"
    ]
  },
  {
    "alert_id": "ALT-IN-CH-CHD-SEC-013-20261002-DEN",
    "timestamp": "2026-10-02T00:00:00Z",
    "country_code": "IN",
    "phc_id": "IN-CH-CHD-SEC-013",
    "district": "Chandigarh",
    "pattern_type": "DENGUE_LIKE",
    "confidence_score": 0.8,
    "severity": "EMERGENCY",
    "correlated_resources": [
      "Paracetamol 500 mg tablet",
      "ORS sachet 20.5g",
      "IV Normal Saline 0.9% 500 mL",
      "Ringer's Lactate 500 mL",
      "Artemether-Lumefantrine tablet",
      "Amoxicillin 500 mg capsule",
      "Azithromycin 500 mg tablet",
      "Metformin 500 mg tablet",
      "Amlodipine 5 mg tablet",
      "Iron-Folic Acid tablet",
      "Zinc sulfate dispersible tablet 20 mg",
      "Disposable syringe 5 mL with needle",
      "Gloves examination sterile/non-sterile",
      "Dengue NS1/IgG/IgM rapid test kit",
      "CBC diagnostic reagent kit",
      "Ciprofloxacin 500 mg tablet",
      "Paracetamol Paediatric Syrup 125 mg/5 mL",
      "Oxytocin Injection 5 IU/mL"
    ],
    "primary_driver": "Paracetamol 500 mg tablet",
    "spatial_cluster_size": 1,
    "recommended_actions": [
      "Pre-position stock of DENGUE_LIKE essential items",
      "Alert district health officer for epidemiological verification",
      "Increase safety stock buffer at facility"
    ]
  },
  {
    "alert_id": "ALT-IN-DL-ND-ALP-004-20261002-DEN",
    "timestamp": "2026-10-02T00:00:00Z",
    "country_code": "IN",
    "phc_id": "IN-DL-ND-ALP-004",
    "district": "North Delhi",
    "pattern_type": "DENGUE_LIKE",
    "confidence_score": 0.8,
    "severity": "EMERGENCY",
    "correlated_resources": [
      "Paracetamol 500 mg tablet",
      "ORS sachet 20.5g",
      "IV Normal Saline 0.9% 500 mL",
      "Ringer's Lactate 500 mL",
      "Artemether-Lumefantrine tablet",
      "Amoxicillin 500 mg capsule",
      "Azithromycin 500 mg tablet",
      "Metformin 500 mg tablet",
      "Amlodipine 5 mg tablet",
      "Iron-Folic Acid tablet",
      "Zinc sulfate dispersible tablet 20 mg",
      "Disposable syringe 5 mL with needle",
      "Gloves examination sterile/non-sterile",
      "Dengue NS1/IgG/IgM rapid test kit",